{
  "session_id": "sess_conflict_a",
  "project": "AI Forge",
  "repository": "abrahamhl/stack-hub-ias",
  "base_commit": "11111111",
  "final_commit": "22222222",
  "branch": "jules/session-evidence-fabric",
  "agent": "AgentA",
  "model": "modelA",
  "provider": "Ollama fallback",
  "started_at": "2024-03-24T10:00:00Z",
  "ended_at": "2024-03-24T11:00:00Z",
  "objective": "Test conflicts",
  "files_read": [],
  "files_changed": [],
  "commits": ["22222222"],
  "decisions": [],
  "commands": [],
  "tests": [],
  "failures": [],
  "reverts": [],
  "deployments": [],
  "artifacts": [],
  "skills_used": [],
  "skills_created": [],
  "workflows_used": [],
  "workflows_created": [],
  "claims": [
    {
      "claim_id": "c_a",
      "text": "Provider is Ollama",
      "category": "Architecture",
      "status": "VERIFIED",
      "evidence": [],
      "origin": "AgentA",
      "confidence": 1.0,
      "safe_for_public": true,
      "safe_for_cv": true,
      "limitations": ""
    }
  ],
  "known_gaps": [],
  "next_actions": []
}
