{
  "session_id": "sess_conflict_b",
  "project": "AI Forge",
  "repository": "abrahamhl/stack-hub-ias",
  "base_commit": "11111111",
  "final_commit": "33333333",
  "branch": "jules/session-evidence-fabric",
  "agent": "AgentB",
  "model": "modelB",
  "provider": "Google Vision only",
  "started_at": "2024-03-24T12:00:00Z",
  "ended_at": "2024-03-24T13:00:00Z",
  "objective": "Test conflicts",
  "files_read": [],
  "files_changed": [],
  "commits": ["33333333"],
  "decisions": [],
  "commands": [],
  "tests": [],
  "failures": [],
  "reverts": [],
  "deployments": [],
  "artifacts": [],
  "skills_used": [],
  "skills_created": [],
  "workflows_used": [],
  "workflows_created": [],
  "claims": [
    {
      "claim_id": "c_b",
      "text": "Provider is Google Vision",
      "category": "Architecture",
      "status": "VERIFIED",
      "evidence": [],
      "origin": "AgentB",
      "confidence": 1.0,
      "safe_for_public": true,
      "safe_for_cv": true,
      "limitations": ""
    }
  ],
  "known_gaps": [],
  "next_actions": []
}
